<?xml version="1.0" encoding="utf-8"?>
<Manifest xmlns:xsi="http://www.w3.org/2001/XMLSchema-instance" xsi:noNamespaceSchemaLocation="AMPManifest.xsd">
  <ModuleName>SenchaWF</ModuleName>
  <ModuleVersion>1</ModuleVersion>
  <ModuleDesc>null</ModuleDesc>
  <ModuleDisplayName>SenchaWF</ModuleDisplayName>
  <ClientIconIndex>48</ClientIconIndex>
  <InvokeOnClient>1</InvokeOnClient>
  <PersistAppDomain>1</PersistAppDomain>
  <MarkProcessedMessages>0</MarkProcessedMessages>
  <DeleteProcessedMessages>0</DeleteProcessedMessages>
  <ProcessUpdates>1</ProcessUpdates>
  <CredentialsCache key="SenchaWF_credentials">0</CredentialsCache>
  <RequiresActivation>0</RequiresActivation>

  <SharedStorage key="">0</SharedStorage>

  <TransformPlugin>
    <File shared="true">WorkflowClient.dll</File>
    <Class>Sybase.UnwiredPlatform.WorkflowClient.Transformer</Class>
  </TransformPlugin>

  <ResponsePlugin>
    <File shared="true">WorkflowClient.dll</File>
    <Class>Sybase.UnwiredPlatform.WorkflowClient.Responder</Class>
  </ResponsePlugin>

  <ClientWorkflows>
    <WindowsMobileProfessional>
      <HTMLWorkflow>
        <File>SenchaWF.xml</File>
        <HtmlFiles>        
          <HtmlFile>html/app/app.js</HtmlFile>        
          <HtmlFile>html/app/controllers/customer_c.js</HtmlFile>        
          <HtmlFile>html/app/controllers/HwcProxy.js</HtmlFile>        
          <HtmlFile>html/app/controllers/proxy_callbacks.js</HtmlFile>        
          <HtmlFile>html/app/models/customer_m.js</HtmlFile>        
          <HtmlFile>html/app/views/customer_detail.js</HtmlFile>        
          <HtmlFile>html/app/views/customer_edit.js</HtmlFile>        
          <HtmlFile>html/app/views/customer_list.js</HtmlFile>        
          <HtmlFile>html/app/views/viewport.js</HtmlFile>        
          <HtmlFile>html/js/API.js</HtmlFile>        
          <HtmlFile>html/js/Callbacks.js</HtmlFile>        
          <HtmlFile>html/js/Camera.js</HtmlFile>        
          <HtmlFile>html/js/Certificate.js</HtmlFile>        
          <HtmlFile>html/js/Custom.js</HtmlFile>        
          <HtmlFile>html/js/ExternalResource.js</HtmlFile>        
          <HtmlFile>html/js/json2.js</HtmlFile>        
          <HtmlFile>html/js/Resources.js</HtmlFile>        
          <HtmlFile>html/js/SUPStorage.js</HtmlFile>        
          <HtmlFile>html/js/Timezone.js</HtmlFile>        
          <HtmlFile>html/js/Utils.js</HtmlFile>        
          <HtmlFile>html/js/Workflow.js</HtmlFile>        
          <HtmlFile>html/js/WorkflowMessage.js</HtmlFile>        
          <HtmlFile>html/lib/resources/css/sencha-touch.css</HtmlFile>        
          <HtmlFile>html/lib/resources/themes/images/default/check.png</HtmlFile>        
          <HtmlFile>html/lib/resources/themes/images/default/disclosure.png</HtmlFile>        
          <HtmlFile>html/lib/resources/themes/images/default/dotgrid.png</HtmlFile>        
          <HtmlFile>html/lib/resources/themes/images/default/loading.gif</HtmlFile>        
          <HtmlFile>html/lib/resources/themes/images/default/pullarrow.png</HtmlFile>        
          <HtmlFile>html/lib/resources/themes/images/default/select_mask.png</HtmlFile>        
          <HtmlFile>html/lib/resources/themes/images/default/tip.png</HtmlFile>        
          <HtmlFile>html/lib/resources/themes/images/default/tip_horizontal.png</HtmlFile>        
          <HtmlFile>html/lib/resources/themes/images/default/tip_right.png</HtmlFile>        
          <HtmlFile>html/lib/resources/themes/images/default/togglebg.png</HtmlFile>        
          <HtmlFile>html/lib/resources/themes/images/default/togglemask.png</HtmlFile>        
          <HtmlFile>html/lib/resources/themes/images/default/togglethumb.png</HtmlFile>        
          <HtmlFile>html/lib/resources/themes/images/default/togglethumbbg.png</HtmlFile>        
          <HtmlFile>html/lib/resources/themes/images/default/togglethumbmask.png</HtmlFile>        
          <HtmlFile>html/lib/resources/themes/images/default/trackmask_outer.png</HtmlFile>        
          <HtmlFile>html/lib/sencha-touch.js</HtmlFile>        
          <HtmlFile>html/rmi-.xml</HtmlFile>        
          <HtmlFile>html/workflow.html</HtmlFile>          
        </HtmlFiles>
      </HTMLWorkflow>
    </WindowsMobileProfessional>
    <BlackBerry>
      <HTMLWorkflow>
        <File>SenchaWF.xml</File>
        <HtmlFiles>        
          <HtmlFile>html/app/app.js</HtmlFile>        
          <HtmlFile>html/app/controllers/customer_c.js</HtmlFile>        
          <HtmlFile>html/app/controllers/HwcProxy.js</HtmlFile>        
          <HtmlFile>html/app/controllers/proxy_callbacks.js</HtmlFile>        
          <HtmlFile>html/app/models/customer_m.js</HtmlFile>        
          <HtmlFile>html/app/views/customer_detail.js</HtmlFile>        
          <HtmlFile>html/app/views/customer_edit.js</HtmlFile>        
          <HtmlFile>html/app/views/customer_list.js</HtmlFile>        
          <HtmlFile>html/app/views/viewport.js</HtmlFile>        
          <HtmlFile>html/js/API.js</HtmlFile>        
          <HtmlFile>html/js/Callbacks.js</HtmlFile>        
          <HtmlFile>html/js/Camera.js</HtmlFile>        
          <HtmlFile>html/js/Certificate.js</HtmlFile>        
          <HtmlFile>html/js/Custom.js</HtmlFile>        
          <HtmlFile>html/js/ExternalResource.js</HtmlFile>        
          <HtmlFile>html/js/json2.js</HtmlFile>        
          <HtmlFile>html/js/Resources.js</HtmlFile>        
          <HtmlFile>html/js/SUPStorage.js</HtmlFile>        
          <HtmlFile>html/js/Timezone.js</HtmlFile>        
          <HtmlFile>html/js/Utils.js</HtmlFile>        
          <HtmlFile>html/js/Workflow.js</HtmlFile>        
          <HtmlFile>html/js/WorkflowMessage.js</HtmlFile>        
          <HtmlFile>html/lib/resources/css/sencha-touch.css</HtmlFile>        
          <HtmlFile>html/lib/resources/themes/images/default/check.png</HtmlFile>        
          <HtmlFile>html/lib/resources/themes/images/default/disclosure.png</HtmlFile>        
          <HtmlFile>html/lib/resources/themes/images/default/dotgrid.png</HtmlFile>        
          <HtmlFile>html/lib/resources/themes/images/default/loading.gif</HtmlFile>        
          <HtmlFile>html/lib/resources/themes/images/default/pullarrow.png</HtmlFile>        
          <HtmlFile>html/lib/resources/themes/images/default/select_mask.png</HtmlFile>        
          <HtmlFile>html/lib/resources/themes/images/default/tip.png</HtmlFile>        
          <HtmlFile>html/lib/resources/themes/images/default/tip_horizontal.png</HtmlFile>        
          <HtmlFile>html/lib/resources/themes/images/default/tip_right.png</HtmlFile>        
          <HtmlFile>html/lib/resources/themes/images/default/togglebg.png</HtmlFile>        
          <HtmlFile>html/lib/resources/themes/images/default/togglemask.png</HtmlFile>        
          <HtmlFile>html/lib/resources/themes/images/default/togglethumb.png</HtmlFile>        
          <HtmlFile>html/lib/resources/themes/images/default/togglethumbbg.png</HtmlFile>        
          <HtmlFile>html/lib/resources/themes/images/default/togglethumbmask.png</HtmlFile>        
          <HtmlFile>html/lib/resources/themes/images/default/trackmask_outer.png</HtmlFile>        
          <HtmlFile>html/lib/sencha-touch.js</HtmlFile>        
          <HtmlFile>html/rmi-.xml</HtmlFile>        
          <HtmlFile>html/workflow.html</HtmlFile>
        </HtmlFiles>
      </HTMLWorkflow>
    </BlackBerry>
    <BlackBerry6>
      <HTMLWorkflow>
        <File>SenchaWF.xml</File>
        <HtmlFiles>        
          <HtmlFile>html/app/app.js</HtmlFile>        
          <HtmlFile>html/app/controllers/customer_c.js</HtmlFile>        
          <HtmlFile>html/app/controllers/HwcProxy.js</HtmlFile>        
          <HtmlFile>html/app/controllers/proxy_callbacks.js</HtmlFile>        
          <HtmlFile>html/app/models/customer_m.js</HtmlFile>        
          <HtmlFile>html/app/views/customer_detail.js</HtmlFile>        
          <HtmlFile>html/app/views/customer_edit.js</HtmlFile>        
          <HtmlFile>html/app/views/customer_list.js</HtmlFile>        
          <HtmlFile>html/app/views/viewport.js</HtmlFile>        
          <HtmlFile>html/js/API.js</HtmlFile>        
          <HtmlFile>html/js/Callbacks.js</HtmlFile>        
          <HtmlFile>html/js/Camera.js</HtmlFile>        
          <HtmlFile>html/js/Certificate.js</HtmlFile>        
          <HtmlFile>html/js/Custom.js</HtmlFile>        
          <HtmlFile>html/js/ExternalResource.js</HtmlFile>        
          <HtmlFile>html/js/json2.js</HtmlFile>        
          <HtmlFile>html/js/Resources.js</HtmlFile>        
          <HtmlFile>html/js/SUPStorage.js</HtmlFile>        
          <HtmlFile>html/js/Timezone.js</HtmlFile>        
          <HtmlFile>html/js/Utils.js</HtmlFile>        
          <HtmlFile>html/js/Workflow.js</HtmlFile>        
          <HtmlFile>html/js/WorkflowMessage.js</HtmlFile>        
          <HtmlFile>html/lib/resources/css/sencha-touch.css</HtmlFile>        
          <HtmlFile>html/lib/resources/themes/images/default/check.png</HtmlFile>        
          <HtmlFile>html/lib/resources/themes/images/default/disclosure.png</HtmlFile>        
          <HtmlFile>html/lib/resources/themes/images/default/dotgrid.png</HtmlFile>        
          <HtmlFile>html/lib/resources/themes/images/default/loading.gif</HtmlFile>        
          <HtmlFile>html/lib/resources/themes/images/default/pullarrow.png</HtmlFile>        
          <HtmlFile>html/lib/resources/themes/images/default/select_mask.png</HtmlFile>        
          <HtmlFile>html/lib/resources/themes/images/default/tip.png</HtmlFile>